{
  "$schema": "http://json-schema.org/draft-07/schema#",
  "title": "Claims Truth Bank",
  "description": "Private-aware store of approved, evidence-backed accomplishment claims and an explicit never-claim list. The real working copy (profile/claims/claims-bank.json) is gitignored; only the sanitized example is tracked. Resume/cover-letter tailoring may only draw on claims with review_status=approved, and only for the lanes named in allowed_lanes. Nothing here may be fabricated.",
  "type": "object",
  "required": ["schema_version", "claims"],
  "properties": {
    "schema_version": { "type": "integer", "const": 1 },
    "_comment": { "type": "string" },
    "claims": {
      "type": "array",
      "items": {
        "type": "object",
        "required": ["claim_id", "claim_text", "review_status", "allowed_lanes"],
        "properties": {
          "claim_id": {
            "type": "string",
            "description": "Stable kebab-case identifier."
          },
          "claim_text": {
            "type": "string",
            "description": "The claim exactly as it may appear in materials. Must be literally true."
          },
          "evidence": {
            "type": "string",
            "description": "Where this is documented/verifiable (repo, PR, metric source, employer). Not a public URL with PII."
          },
          "technologies": {
            "type": "array",
            "items": { "type": "string" }
          },
          "impact": {
            "type": ["string", "null"],
            "description": "Measurable outcome, or null if no defensible metric exists (do NOT invent one)."
          },
          "allowed_lanes": {
            "type": "array",
            "items": { "type": "string" },
            "description": "Resume variant ids (from config/resume-variants.json) this claim may appear in."
          },
          "confidence": {
            "type": "string",
            "enum": ["high", "medium", "low"]
          },
          "review_status": {
            "type": "string",
            "enum": ["approved", "draft", "rejected"],
            "description": "Only 'approved' claims may be used in generated materials."
          },
          "fabrication_risk": {
            "type": "string",
            "description": "Notes on exaggeration/over-claim risk and how the wording stays honest."
          }
        }
      }
    },
    "never_claim": {
      "type": "array",
      "items": {
        "type": "object",
        "required": ["text", "reason"],
        "properties": {
          "text": { "type": "string" },
          "reason": { "type": "string" }
        }
      }
    }
  }
}
